{
  "$schema": "http://json-schema.org/draft-07/schema#",
  "$id": "blueprint-plugin/feature-tracker.schema.json",
  "title": "Feature Tracker",
  "description": "Schema for tracking feature implementation status aligned with requirements documents",
  "type": "object",
  "required": [
    "version",
    "last_updated",
    "project",
    "source_document",
    "phases",
    "features"
  ],
  "properties": {
    "$schema": {
      "type": "string",
      "description": "Reference to this schema file"
    },
    "version": {
      "type": "string",
      "pattern": "^\\d+\\.\\d+\\.\\d+$",
      "description": "Semantic version of the tracker format"
    },
    "last_updated": {
      "type": "string",
      "format": "date",
      "description": "Date of last update (YYYY-MM-DD)"
    },
    "project": {
      "type": "string",
      "description": "Project name"
    },
    "source_document": {
      "type": "string",
      "description": "Primary requirements document (e.g., REQUIREMENTS.md)"
    },
    "current_phase": {
      "type": "string",
      "pattern": "^phase-\\d+$",
      "description": "Currently active phase (e.g., phase-1)"
    },
    "tasks": {
      "$ref": "#/definitions/tasks",
      "description": "Active and pending tasks (replaces work-overview.md)"
    },
    "phases": {
      "type": "array",
      "description": "Development phases",
      "items": {
        "$ref": "#/definitions/phase"
      }
    },
    "features": {
      "description": "Feature requirements. Two shapes exist in the wild and both are accepted: an OBJECT keyed FR1/FR2 (the canonical form this schema originally declared), and an ARRAY of the same records (used by reporting repos). blueprint-tracker-check.sh handles both and reports which it found as FEATURES_SHAPE=. The schema has to describe what the system accepts, or the tolerance lives only in a script comment.",
      "anyOf": [
        {
          "type": "object",
          "title": "keyed by FR code",
          "patternProperties": {
            "^FR\\d+$": {
              "$ref": "#/definitions/featureCategory"
            }
          },
          "additionalProperties": false
        },
        {
          "type": "array",
          "title": "array of feature records",
          "items": {
            "$ref": "#/definitions/featureCategory"
          }
        }
      ]
    },
    "prds": {
      "type": "object",
      "description": "Product Requirements Documents and their status",
      "patternProperties": {
        "^PRD_[A-Z_]+$": {
          "$ref": "#/definitions/prd"
        }
      },
      "additionalProperties": false
    },
    "statistics": {
      "$ref": "#/definitions/statistics"
    },
    "workspaces": {
      "type": "object",
      "description": "Monorepo portfolio: cached rollup stats keyed by child workspace relative path. Populated by blueprint:feature-tracker-sync at root blueprints (format_version >= 3.3.0).",
      "additionalProperties": {
        "$ref": "#/definitions/workspaceStats"
      }
    }
  },
  "definitions": {
    "status": {
      "type": "string",
      "enum": [
        "not_started",
        "in_progress",
        "partial",
        "complete",
        "blocked"
      ],
      "description": "Implementation status"
    },
    "tasks": {
      "type": "object",
      "description": "Active and pending tasks for progress tracking",
      "properties": {
        "in_progress": {
          "type": "array",
          "items": {
            "$ref": "#/definitions/task"
          },
          "description": "Tasks currently being worked on"
        },
        "pending": {
          "type": "array",
          "items": {
            "$ref": "#/definitions/task"
          },
          "description": "Tasks queued for future work"
        },
        "completed": {
          "type": "array",
          "items": {
            "$ref": "#/definitions/task"
          },
          "description": "Recently completed tasks (last 10)"
        }
      }
    },
    "task": {
      "type": "object",
      "required": [
        "id",
        "description"
      ],
      "properties": {
        "id": {
          "type": "string",
          "description": "Task identifier (FR code, WO-NNN, or custom)"
        },
        "description": {
          "type": "string",
          "description": "Brief task description"
        },
        "source": {
          "type": "string",
          "description": "Source document (PRP-NNN, PRD-NNN, WO-NNN)"
        },
        "added": {
          "type": "string",
          "format": "date",
          "description": "Date task was added"
        },
        "completed": {
          "type": "string",
          "format": "date",
          "description": "Date task was completed (for completed tasks)"
        }
      }
    },
    "phase": {
      "type": "object",
      "required": [
        "id",
        "name",
        "status"
      ],
      "properties": {
        "id": {
          "type": "string",
          "pattern": "^phase-\\d+$",
          "description": "Phase identifier (e.g., phase-0)"
        },
        "name": {
          "type": "string",
          "description": "Human-readable phase name"
        },
        "status": {
          "$ref": "#/definitions/status"
        }
      }
    },
    "featureCategory": {
      "type": "object",
      "required": [
        "name",
        "features"
      ],
      "properties": {
        "name": {
          "type": "string",
          "description": "Category name"
        },
        "features": {
          "type": "object",
          "description": "Features within this category",
          "patternProperties": {
            "^FR\\d+(\\.\\d+)+$": {
              "$ref": "#/definitions/feature"
            }
          },
          "additionalProperties": false
        }
      }
    },
    "feature": {
      "type": "object",
      "required": [
        "name",
        "status",
        "phase"
      ],
      "properties": {
        "name": {
          "type": "string",
          "description": "Feature name"
        },
        "description": {
          "type": "string",
          "description": "Brief description of the feature"
        },
        "status": {
          "$ref": "#/definitions/status"
        },
        "phase": {
          "type": "string",
          "pattern": "^phase-\\d+$",
          "description": "Reference to implementation phase"
        },
        "prd": {
          "type": [
            "string",
            "null"
          ],
          "description": "Associated PRD document name (null if none)"
        },
        "implementation": {
          "oneOf": [
            {
              "type": "null"
            },
            {
              "$ref": "#/definitions/implementation"
            }
          ],
          "description": "Implementation details (null if not started)"
        },
        "features": {
          "type": "object",
          "description": "Nested sub-features",
          "patternProperties": {
            "^FR\\d+(\\.\\d+)+$": {
              "$ref": "#/definitions/feature"
            }
          },
          "additionalProperties": false
        },
        "implemented_by": {
          "type": "array",
          "description": "Monorepo portfolio: cross-workspace references to child-workspace FRs that implement this portfolio feature. When non-empty, status is derived by blueprint:feature-tracker-sync (format_version >= 3.3.0).",
          "items": {
            "$ref": "#/definitions/implementedByRef"
          }
        }
      }
    },
    "implementedByRef": {
      "type": "object",
      "required": [
        "workspace",
        "ref"
      ],
      "properties": {
        "workspace": {
          "type": "string",
          "description": "Relative path from the root blueprint to the child workspace (e.g., 'projects/esp32-lamp')"
        },
        "ref": {
          "type": "string",
          "description": "Feature code in the child workspace's feature-tracker.json (e.g., 'FR3.2')"
        }
      }
    },
    "workspaceStats": {
      "type": "object",
      "description": "Cached rollup statistics for a child workspace",
      "properties": {
        "total": {
          "type": "integer",
          "minimum": 0
        },
        "complete": {
          "type": "integer",
          "minimum": 0
        },
        "completion_percentage": {
          "type": "number",
          "minimum": 0,
          "maximum": 100
        },
        "current_phase": {
          "type": [
            "string",
            "null"
          ],
          "description": "Child workspace's currently active phase"
        },
        "last_synced_at": {
          "type": "string",
          "format": "date-time",
          "description": "Timestamp of last sync from child feature-tracker"
        }
      }
    },
    "implementation": {
      "type": "object",
      "properties": {
        "files": {
          "type": "array",
          "items": {
            "type": "string"
          },
          "description": "Source files involved in implementation"
        },
        "notes": {
          "type": "string",
          "description": "Implementation notes and details"
        },
        "tests": {
          "type": "array",
          "items": {
            "type": "string"
          },
          "description": "Test files or test function names"
        },
        "commits": {
          "type": "array",
          "items": {
            "type": "string"
          },
          "description": "Related commit hashes"
        }
      }
    },
    "prd": {
      "type": "object",
      "required": [
        "name",
        "status",
        "features_implemented"
      ],
      "properties": {
        "name": {
          "type": "string",
          "description": "PRD human-readable name"
        },
        "status": {
          "$ref": "#/definitions/status"
        },
        "features_implemented": {
          "type": "array",
          "items": {
            "type": "string"
          },
          "description": "List of FR codes or feature descriptions implemented"
        },
        "tests_passing": {
          "type": "integer",
          "minimum": 0,
          "description": "Number of tests passing for this PRD"
        },
        "work_orders": {
          "type": "array",
          "items": {
            "type": "string"
          },
          "description": "Associated work order IDs"
        }
      }
    },
    "statistics": {
      "type": "object",
      "properties": {
        "total_features": {
          "type": "integer",
          "minimum": 0
        },
        "complete": {
          "type": "integer",
          "minimum": 0
        },
        "partial": {
          "type": "integer",
          "minimum": 0
        },
        "in_progress": {
          "type": "integer",
          "minimum": 0
        },
        "not_started": {
          "type": "integer",
          "minimum": 0
        },
        "blocked": {
          "type": "integer",
          "minimum": 0
        },
        "completion_percentage": {
          "type": "number",
          "minimum": 0,
          "maximum": 100
        }
      }
    }
  }
}
